{
  "schemaVersion": 1,
  "id": "mega-city-tycoon",
  "product": {
    "title": "Mega City Tycoon",
    "family": "track-101",
    "pillar": "economics",
    "summary": "A city-building economics game where students balance a municipal budget against growth.",
    "whatStudentsDo": "Students run a growing city, choosing where to spend a limited budget across services and development, and watch the trade-offs land as the city's needs change around them.",
    "concepts": [
      "econ.scarcity",
      "econ.tradeoffs",
      "econ.opportunity-cost",
      "econ.cost-benefit-analysis"
    ],
    "gradeBands": [
      "5",
      "6"
    ],
    "gradeBandBasis": "track-convention",
    "purpose": {
      "primary": "APPLY",
      "secondary": [
        "PRACTICE"
      ]
    },
    "delivery": {
      "setting": [
        "self-guided"
      ],
      "grouping": [
        "individual"
      ],
      "mode": [
        "online"
      ],
      "devices": "one browser per student"
    },
    "facilitation": {
      "founderDependence": "any-instructor"
    },
    "pattern": [
      "allocation-under-constraint",
      "business-operator"
    ],
    "technology": "single-file HTML/CSS/JS, no build step",
    "evidenceOutput": "none",
    "studentDataProfile": {
      "storesStudentData": "no",
      "requiresLogin": "no",
      "usesClassCodes": "no",
      "freeTextEntry": "unknown",
      "thirdPartyServices": [],
      "notes": "State kept in browser localStorage only; no server call observed."
    },
    "source": {
      "primary": {
        "type": "github",
        "repo": "braydenokley13-ux/101-M1-ECON",
        "path": "index.html"
      },
      "additional": [
        {
          "type": "github",
          "repo": "braydenokley13-ux/101-M1-ECON",
          "path": "apps script"
        }
      ]
    },
    "runResources": [
      {
        "kind": "live-url",
        "label": "Play in browser (GitHub Pages)",
        "url": "https://braydenokley13-ux.github.io/101-M1-ECON/",
        "verified": "2026-08-14"
      },
      {
        "kind": "repo",
        "label": "Source",
        "url": "https://github.com/braydenokley13-ux/101-M1-ECON"
      }
    ]
  },
  "governance": {
    "maturity": "PLAYABLE",
    "maturityBasis": "Runs end-to-end and is publicly reachable. No student-run evidence exists.",
    "visibility": "active",
    "publicListing": false,
    "owner": {
      "productOwner": "UNOWNED"
    },
    "health": {
      "technical": "healthy",
      "technicalBasis": "GitHub Pages returned 200 on 2026-08-14. Reachability only.",
      "documentation": "missing",
      "knownBlockers": []
    },
    "validation": {
      "studentValidation": "unknown",
      "facilitatorValidation": "unknown"
    },
    "lastVerified": {
      "technical": "2026-08-14"
    }
  },
  "provenance": {
    "discoveredBy": "account-wide discovery, August 2026",
    "discoveredOn": "2026-08-14",
    "confidence": "INFERRED",
    "evidence": "101-M1-ECON/index.html <title>MEGA CITY TYCOON - Economics Adventure!</title>. Repo also holds a Google Apps Script ('BOW MODULE 1 — FINAL ECON SIMULATION v2.0') and 'Copy of BSC- Module 1 Econ Final - 101.xlsx'.",
    "openQuestions": [
      "The Apps Script in this repo may be a separate spreadsheet simulation rather than a second delivery of this one. Recorded as one entry to avoid inflating the portfolio; needs a human read to split."
    ]
  }
}
