{
  "schemaVersion": 1,
  "id": "nfl-system-stress-test",
  "product": {
    "title": "NFL System Stress Test",
    "family": "track-301",
    "pillar": "cross-pillar",
    "summary": "Judge whether a shock strengthens, strains or breaks an organisation.",
    "whatStudentsDo": "Students read fifteen real stress scenarios across five teams, each with its own organisational profile, and classify each as something the system needs, absorbs, is strained by, or breaks under. A tutorial mode walks three scenarios with answers shown; the real mode runs all fifteen blind and scored.",
    "concepts": [
      "econ.operations-tradeoffs",
      "econ.uncertainty",
      "econ.reputation-risk",
      "econ.stakeholder-management",
      "econ.roster-construction"
    ],
    "gradeBandBasis": "unknown",
    "purpose": {
      "primary": "PRACTICE",
      "secondary": [
        "EVIDENCE"
      ]
    },
    "delivery": {
      "setting": [
        "self-guided"
      ],
      "grouping": [
        "individual"
      ],
      "mode": [
        "online"
      ],
      "devices": "one browser per student"
    },
    "facilitation": {
      "founderDependence": "any-instructor"
    },
    "pattern": [
      "signal-vs-noise",
      "crisis-management"
    ],
    "technology": "single-file HTML/CSS/JS, no build step",
    "evidenceOutput": "scored-outcomes",
    "studentDataProfile": {
      "storesStudentData": "no",
      "requiresLogin": "no",
      "usesClassCodes": "no",
      "freeTextEntry": "unknown",
      "thirdPartyServices": [],
      "notes": "State kept in browser localStorage only; no server call observed."
    },
    "source": {
      "primary": {
        "type": "github",
        "repo": "braydenokley13-ux/301-M2-L3",
        "path": "index.html"
      }
    },
    "runResources": [
      {
        "kind": "live-url",
        "label": "Play in browser (GitHub Pages)",
        "url": "https://braydenokley13-ux.github.io/301-M2-L3/",
        "verified": "2026-08-14"
      },
      {
        "kind": "repo",
        "label": "Source",
        "url": "https://github.com/braydenokley13-ux/301-M2-L3"
      }
    ]
  },
  "governance": {
    "maturity": "PLAYABLE",
    "maturityBasis": "The most thoroughly self-documented repo in the Track 301 set, including its own honest list of limitations. No student-run evidence exists.",
    "visibility": "active",
    "publicListing": false,
    "owner": {
      "productOwner": "UNOWNED"
    },
    "health": {
      "technical": "healthy",
      "technicalBasis": "GitHub Pages returned 200 on 2026-08-14. Reachability only.",
      "documentation": "complete",
      "knownBlockers": []
    },
    "validation": {
      "studentValidation": "unknown",
      "facilitatorValidation": "unknown"
    },
    "lastVerified": {
      "technical": "2026-08-14"
    }
  },
  "provenance": {
    "discoveredBy": "account-wide discovery, August 2026",
    "discoveredOn": "2026-08-14",
    "confidence": "VERIFIED",
    "evidence": "301-M2-L3/README.md documents the four classifications, the tutorial and real modes, and tiered claim codes L3-301-M2-GOLD-PRESSURE, SILVER-ANALYST and BRONZE-SYSTEMS. Recorded as one experience with two modes."
  }
}
