{
  "schemaVersion": 1,
  "id": "gm-trade-challenge",
  "product": {
    "title": "GM Trade Challenge — The 5-Minute Decision Maker",
    "family": "track-201",
    "pillar": "economics",
    "summary": "Timed trade calls across escalating difficulty tiers.",
    "whatStudentsDo": "Students work three rounds per difficulty level against a countdown, choosing among trade packages that trade certainty for upside, with a running score across levels.",
    "concepts": [
      "econ.expected-value",
      "econ.risk-and-reward",
      "econ.pick-value-and-decay",
      "econ.marginal-value"
    ],
    "gradeBands": [
      "7",
      "8"
    ],
    "gradeBandBasis": "track-convention",
    "purpose": {
      "primary": "PRACTICE"
    },
    "delivery": {
      "setting": [
        "self-guided"
      ],
      "grouping": [
        "individual"
      ],
      "mode": [
        "online"
      ],
      "devices": "one browser per student"
    },
    "facilitation": {
      "founderDependence": "any-instructor"
    },
    "pattern": [
      "trade-and-exchange"
    ],
    "technology": "single-file HTML/CSS/JS, no build step",
    "evidenceOutput": "none",
    "studentDataProfile": {
      "storesStudentData": "no",
      "requiresLogin": "no",
      "usesClassCodes": "no",
      "freeTextEntry": "unknown",
      "thirdPartyServices": [],
      "notes": "State kept in browser localStorage only; no server call observed."
    },
    "source": {
      "primary": {
        "type": "github",
        "repo": "braydenokley13-ux/201-M4-L3",
        "path": "index.html"
      },
      "additional": [
        {
          "type": "github",
          "repo": "braydenokley13-ux/201-M4-L3",
          "path": "Bow 201 M4L3 - Pick Trades.xlsx"
        }
      ]
    },
    "runResources": [
      {
        "kind": "live-url",
        "label": "Play in browser (GitHub Pages)",
        "url": "https://braydenokley13-ux.github.io/201-M4-L3/",
        "verified": "2026-08-14"
      },
      {
        "kind": "repo",
        "label": "Source",
        "url": "https://github.com/braydenokley13-ux/201-M4-L3"
      }
    ]
  },
  "governance": {
    "maturity": "PLAYABLE",
    "maturityBasis": "Complete and publicly reachable. No student-run evidence exists.",
    "visibility": "active",
    "publicListing": false,
    "owner": {
      "productOwner": "UNOWNED"
    },
    "health": {
      "technical": "healthy",
      "technicalBasis": "GitHub Pages returned 200 on 2026-08-14. Reachability only.",
      "documentation": "minimal",
      "knownBlockers": []
    },
    "validation": {
      "studentValidation": "unknown",
      "facilitatorValidation": "unknown"
    },
    "lastVerified": {
      "technical": "2026-08-14"
    }
  },
  "provenance": {
    "discoveredBy": "account-wide discovery, August 2026",
    "discoveredOn": "2026-08-14",
    "confidence": "VERIFIED",
    "evidence": "201-M4-L3/index.html defines levels with per-level timers (e.g. 'Rookie GM', timer 90) and three rounds each. The title's '5-Minute' refers to decision pacing, not session length, so no duration is recorded."
  }
}
