{
  "schemaVersion": 1,
  "id": "bsc-pregame-cap-simulator",
  "product": {
    "title": "BOW Sports Capital: Pregame",
    "family": "pre-course",
    "pillar": "economics",
    "summary": "A twelve-week single-player front-office season with a running CBA glossary.",
    "whatStudentsDo": "Students take a team through a twelve-week season as club president, making a major decision each week plus minor ones, working a trade deadline and a finale, while a glossary panel defines each cap term as it becomes relevant. Owner patience running out ends the run.",
    "concepts": [
      "econ.salary-cap",
      "econ.luxury-tax",
      "econ.bird-rights",
      "econ.mid-level-exception",
      "econ.roster-windows",
      "econ.time-horizon"
    ],
    "gradeBandBasis": "unknown",
    "purpose": {
      "primary": "EXPLORE"
    },
    "delivery": {
      "setting": [
        "self-guided"
      ],
      "grouping": [
        "individual"
      ],
      "mode": [
        "online"
      ],
      "devices": "one browser per student"
    },
    "facilitation": {
      "founderDependence": "any-instructor"
    },
    "pattern": [
      "business-operator",
      "allocation-under-constraint"
    ],
    "evidenceOutput": "unknown",
    "studentDataProfile": {
      "storesStudentData": "no",
      "requiresLogin": "no",
      "usesClassCodes": "no",
      "freeTextEntry": "unknown",
      "thirdPartyServices": [],
      "notes": "State kept in browser localStorage only; no server call observed."
    },
    "source": {
      "primary": {
        "type": "github",
        "repo": "braydenokley13-ux/BSC-pre-course",
        "path": "index.html"
      }
    },
    "runResources": [
      {
        "kind": "live-url",
        "label": "Play in browser (GitHub Pages)",
        "url": "https://braydenokley13-ux.github.io/BSC-pre-course/",
        "verified": "2026-08-14"
      },
      {
        "kind": "repo",
        "label": "Source",
        "url": "https://github.com/braydenokley13-ux/BSC-pre-course"
      }
    ]
  },
  "governance": {
    "maturity": "EXPERIMENTAL",
    "maturityBasis": "The file's own header carries an unfinished polish checklist, and the product is undocumented — its own repo README never mentions it.",
    "visibility": "active",
    "publicListing": false,
    "owner": {
      "productOwner": "UNOWNED"
    },
    "health": {
      "technical": "healthy",
      "technicalBasis": "GitHub Pages returned 200 on 2026-08-14. Reachability only.",
      "documentation": "missing",
      "knownBlockers": [
        "Undocumented: not referenced by the repo README or by the Next.js app it sits beside.",
        "Its own header checklist lists animation, responsive and storage verification as outstanding."
      ]
    },
    "validation": {
      "studentValidation": "unknown",
      "facilitatorValidation": "unknown"
    },
    "lastVerified": {
      "technical": "2026-08-14"
    }
  },
  "provenance": {
    "discoveredBy": "account-wide discovery, August 2026",
    "discoveredOn": "2026-08-14",
    "confidence": "VERIFIED",
    "evidence": "BSC-pre-course/game.js opens with an unresolved 'Polish Checklist'. index.html <title>BOW Sports Capital: Pregame</title>. Uses vocabulary (BRI, escrow, second apron, repeater tax) well above the repo's stated Grade 5-6 reading target, and states no grade band of its own.",
    "openQuestions": [
      "Sits in the BSC-pre-course repo but is unconnected to that app. Its audience is unclear — the CBA vocabulary is far above the repo's stated Grade 5-6 target."
    ]
  }
}
