{
  "schemaVersion": 1,
  "id": "moneyball-draft-challenge",
  "product": {
    "title": "Moneyball Draft Challenge",
    "family": "track-101",
    "pillar": "economics",
    "summary": "Drafting on measured value rather than reputation.",
    "whatStudentsDo": "Students draft players using performance data instead of name recognition, discovering that the cheapest productive player often beats the famous expensive one.",
    "concepts": [
      "econ.analytics-and-war",
      "econ.market-inefficiency",
      "econ.surplus-value",
      "econ.asset-valuation"
    ],
    "gradeBands": [
      "5",
      "6"
    ],
    "gradeBandBasis": "track-convention",
    "purpose": {
      "primary": "INTRODUCE",
      "secondary": [
        "PRACTICE"
      ]
    },
    "delivery": {
      "setting": [
        "self-guided"
      ],
      "grouping": [
        "individual"
      ],
      "mode": [
        "online"
      ],
      "devices": "one browser per student"
    },
    "facilitation": {
      "founderDependence": "any-instructor"
    },
    "pattern": [
      "draft-and-selection"
    ],
    "technology": "single-file HTML/CSS/JS, no build step",
    "evidenceOutput": "none",
    "studentDataProfile": {
      "storesStudentData": "no",
      "requiresLogin": "no",
      "usesClassCodes": "no",
      "freeTextEntry": "unknown",
      "thirdPartyServices": [],
      "notes": "State kept in browser localStorage only; no server call observed."
    },
    "source": {
      "primary": {
        "type": "github",
        "repo": "braydenokley13-ux/101-M3-L1",
        "path": "index.html"
      }
    },
    "runResources": [
      {
        "kind": "live-url",
        "label": "Play in browser (GitHub Pages)",
        "url": "https://braydenokley13-ux.github.io/101-M3-L1/",
        "verified": "2026-08-14"
      },
      {
        "kind": "repo",
        "label": "Source",
        "url": "https://github.com/braydenokley13-ux/101-M3-L1"
      }
    ]
  },
  "governance": {
    "maturity": "PLAYABLE",
    "maturityBasis": "Runs end-to-end and is publicly reachable. No student-run evidence exists.",
    "visibility": "active",
    "publicListing": false,
    "owner": {
      "productOwner": "UNOWNED"
    },
    "health": {
      "technical": "healthy",
      "technicalBasis": "GitHub Pages returned 200 on 2026-08-14. Reachability only.",
      "documentation": "minimal",
      "knownBlockers": []
    },
    "validation": {
      "studentValidation": "unknown",
      "facilitatorValidation": "unknown"
    },
    "lastVerified": {
      "technical": "2026-08-14"
    }
  },
  "provenance": {
    "discoveredBy": "account-wide discovery, August 2026",
    "discoveredOn": "2026-08-14",
    "confidence": "VERIFIED",
    "evidence": "101-M3-L1/index.html <title>⚾ Moneyball Draft Challenge</title>."
  }
}
