{
  "schemaVersion": 1,
  "id": "model-risk-false-confidence",
  "product": {
    "title": "Model Risk & False Confidence",
    "family": "track-301",
    "pillar": "economics",
    "summary": "Spot false precision, catch overfitting, and resist a room that already agrees.",
    "whatStudentsDo": "Students work three levels: finding false precision in real projections, identifying models that explain the past too well and the future badly, then choosing the right executive response to a confident model output that everyone in the room already believes. Each answer returns a worked explanation.",
    "concepts": [
      "econ.model-risk",
      "econ.signal-vs-noise",
      "econ.uncertainty",
      "econ.expected-value"
    ],
    "gradeBandBasis": "unknown",
    "purpose": {
      "primary": "PRACTICE",
      "secondary": [
        "EVIDENCE"
      ]
    },
    "delivery": {
      "setting": [
        "self-guided"
      ],
      "grouping": [
        "individual"
      ],
      "mode": [
        "online"
      ],
      "devices": "one browser per student"
    },
    "facilitation": {
      "founderDependence": "any-instructor"
    },
    "pattern": [
      "signal-vs-noise"
    ],
    "technology": "single-file HTML/CSS/JS, no build step",
    "evidenceOutput": "scored-outcomes",
    "studentDataProfile": {
      "storesStudentData": "no",
      "requiresLogin": "no",
      "usesClassCodes": "no",
      "freeTextEntry": "unknown",
      "thirdPartyServices": [],
      "notes": "State kept in browser localStorage only; no server call observed."
    },
    "source": {
      "primary": {
        "type": "github",
        "repo": "braydenokley13-ux/301-M4-L3",
        "path": "index.html"
      }
    },
    "runResources": [
      {
        "kind": "live-url",
        "label": "Play in browser (GitHub Pages)",
        "url": "https://braydenokley13-ux.github.io/301-M4-L3/",
        "verified": "2026-08-14"
      },
      {
        "kind": "repo",
        "label": "Source",
        "url": "https://github.com/braydenokley13-ux/301-M4-L3"
      }
    ]
  },
  "governance": {
    "maturity": "PLAYABLE",
    "maturityBasis": "Complete, publicly reachable and the most privacy-minimal build in the Track 301 set — it collects nothing. No student-run evidence exists.",
    "visibility": "active",
    "publicListing": false,
    "owner": {
      "productOwner": "UNOWNED"
    },
    "health": {
      "technical": "healthy",
      "technicalBasis": "GitHub Pages returned 200 on 2026-08-14. Reachability only.",
      "documentation": "minimal",
      "knownBlockers": []
    },
    "validation": {
      "studentValidation": "unknown",
      "facilitatorValidation": "unknown"
    },
    "lastVerified": {
      "technical": "2026-08-14"
    },
    "notes": "Its structure is closer to a worked diagnostic quiz than a turn-based simulation. It is included because the decisions are genuine judgement calls with explained consequences, but it sits at the boundary of the inclusion rule."
  },
  "provenance": {
    "discoveredBy": "account-wide discovery, August 2026",
    "discoveredOn": "2026-08-14",
    "confidence": "VERIFIED",
    "evidence": "301-M4-L3/index.html: 'This game trains you to spot false confidence, resist overfitting traps, and think like an executive who never confuses confidence with correctness.'"
  }
}
