{
  "schemaVersion": 1,
  "id": "business-economics-challenge",
  "product": {
    "title": "Business Economics Challenge",
    "family": "track-301",
    "pillar": "economics",
    "summary": "Fourteen timed rounds of business economics under live company metrics.",
    "whatStudentsDo": "Students lead strategy across fourteen rounds, answering scenario questions on contracts, risk-adjusted return, diversification, moral hazard and capital structure while cash, growth, trust, compliance and risk respond, using three lifelines and a streak multiplier, ending in a board report.",
    "concepts": [
      "econ.principal-agent",
      "econ.risk-and-reward",
      "econ.portfolio-thinking",
      "econ.expected-value",
      "econ.asset-valuation",
      "econ.capital-and-investment"
    ],
    "gradeBands": [
      "9",
      "10"
    ],
    "gradeBandBasis": "stated-in-source",
    "purpose": {
      "primary": "PRACTICE",
      "secondary": [
        "EVIDENCE"
      ]
    },
    "delivery": {
      "setting": [
        "self-guided"
      ],
      "grouping": [
        "individual"
      ],
      "mode": [
        "online"
      ],
      "devices": "one browser per student"
    },
    "facilitation": {
      "founderDependence": "any-instructor"
    },
    "pattern": [
      "business-operator"
    ],
    "technology": "single-file HTML/CSS/JS, no build step",
    "evidenceOutput": "scored-outcomes",
    "studentDataProfile": {
      "storesStudentData": "no",
      "requiresLogin": "no",
      "usesClassCodes": "no",
      "freeTextEntry": "unknown",
      "thirdPartyServices": [],
      "notes": "State kept in browser localStorage only; no server call observed."
    },
    "source": {
      "primary": {
        "type": "github",
        "repo": "braydenokley13-ux/301-M2-ECON",
        "path": "index.html"
      }
    },
    "runResources": [
      {
        "kind": "live-url",
        "label": "Play in browser (GitHub Pages)",
        "url": "https://braydenokley13-ux.github.io/301-M2-ECON/",
        "verified": "2026-08-14"
      },
      {
        "kind": "repo",
        "label": "Source",
        "url": "https://github.com/braydenokley13-ux/301-M2-ECON"
      }
    ]
  },
  "governance": {
    "maturity": "PLAYABLE",
    "maturityBasis": "Complete, documented and publicly reachable. No student-run evidence exists.",
    "visibility": "active",
    "publicListing": false,
    "owner": {
      "productOwner": "UNOWNED"
    },
    "health": {
      "technical": "healthy",
      "technicalBasis": "GitHub Pages returned 200 on 2026-08-14. Reachability only.",
      "documentation": "partial",
      "knownBlockers": []
    },
    "validation": {
      "studentValidation": "unknown",
      "facilitatorValidation": "unknown"
    },
    "lastVerified": {
      "technical": "2026-08-14"
    }
  },
  "provenance": {
    "discoveredBy": "account-wide discovery, August 2026",
    "discoveredOn": "2026-08-14",
    "confidence": "VERIFIED",
    "evidence": "301-M2-ECON/README.md: 'Interactive business simulation game for 9th-10th graders' and '14 rounds'.",
    "openQuestions": [
      "The repo's only commit is titled 'Delete 301-M2-ECON directory' while adding every file, suggesting extraction from a former monorepo. Provenance is unresolved."
    ]
  }
}
